;ArticleTitle;Question;Answer;Theme column;Fact;Levin_question;Levin_answer;Shingles_question;Shingles_answer;difflib_question;difflib_answer;Levin_count;Shingle_count;difflib_count
97;James Monroe;Who was Monroe's wife?;elizabeth kortright; monroe's wife;yes;what is monroe's father's name?;spence;"[""what is monroe's father's name?""]";spence;what is henri becquerel?;henri becquerel was a famous physicist.;0;0;0
98;James Watt;Who was James Watt's mother?;agnus muirhead; james watt's mother;yes;for how many years of james watt's life was his mother alive?;17 years;"[""what was the name of james watt's mother?""]";agnus muirhead;what was the name of james watt's mother?;agnus muirhead;0;1;1
99;John Adams;Did Stamp Act of 1765 was supported by John Adams?;no; stamp act 1765 supported john adams;yes;did john adams support the stamp act of 1765?;no;did john adams support the stamp act of 1765?;no;what was the name of james watt's mother?;agnus muirhead;1;1;0
100;John Adams;In each year Adams finished his education in college?;1755.; year adams finished education college;yes;when did adams graduate from college?;1755.;when did adams graduate from college?;1755.;what was the name of james watt's mother?;agnus muirhead;1;1;0
101;leopard;How is hybrid of leopard and puma called?;a pumapard; hybrid leopard puma called;yes;what is a hybrid animal resulting from a union between a leopard and a puma?;a pumapard;what is a hybrid animal resulting from a union between a leopard and a puma?;a pumapard;what was the name of james watt's mother?;agnus muirhead;1;1;0
102;leopard;Is leopard smallest among Panteras?;yes; leopard smallest panteras;yes;is the leopard -lrb- panthera pardus -rrb- an old world mammal of the felidae family and the smallest of the four (`` ` big cats ('' ' of the genus panthera , along with the tiger , lion , and jaguar?;yes;is the leopard smaller than the other members of panthera?;yes;what was the name of james watt's mother?;agnus muirhead;1;1;0
103;leopard;What is a weight of leopard?;males are considerably larger than females and weigh 37 to 90 kg compared to 28 to 60 kg for females. ; weight leopard;yes;how much does a leopard weigh?;males are considerably larger than females and weigh 37 to 90 kg compared to 28 to 60 kg for females. ;how much does a leopard weigh?;males are considerably larger than females and weigh 37 to 90 kg compared to 28 to 60 kg for females. ;what was the name of james watt's mother?;agnus muirhead;1;1;0
104;Liechtenstein;Is it smallest country which has german as official language?;yes; smallest country german official language;yes;is an official language of canada german?;no.;is an official language of canada german?;no.;what was the name of james watt's mother?;agnus muirhead;0;0;0
105;Liechtenstein;Is Liechtenstein has common border with Switzerland?;yes; liechtenstein common border switzerland;yes;in switzerland, is ß used at all?;no;is liechtenstein bordered by switzerland?;yes;what was the name of james watt's mother?;agnus muirhead;0;1;0
106;Liechtenstein;With which countries Liechtenstein has common border?;switzerland and austria.; countries liechtenstein common border;yes;what countries border liechtenstein?;switzerland and austria.;what countries border liechtenstein?;switzerland and austria.;what was the name of james watt's mother?;agnus muirhead;1;1;0
107;Lima;Is Museum of Gold placed in Lima?;yes.; museum gold placed lima;yes;is the museum of gold in lima?;yes.;is the museum of gold in lima?;yes.;what was the name of james watt's mother?;agnus muirhead;1;1;0
108;Lima;When was Lima established?;january 18,1535.; lima established;yes;after what event was the turkish language association established?;after the foundation of the republic of turkey and the script reform, the turkish language association (tdk) was established in 1932.;what established a trading post on the island in 1819?;british east india company ;what was the name of james watt's mother?;agnus muirhead;0;0;0
109;Lima;Does National Universityof San Marcos placed in Lima?;yes.; national universityof san marcos placed lima;yes;is the national university of san marcos in lima?;yes.;is the national university of san marcos in lima?;yes.;what was the name of james watt's mother?;agnus muirhead;1;1;0
110;Lyre;Do people in modern Greece play lyre?;no; people modern greece play lyre;yes;is lyre played in mordern greece?;no;is lyre played in mordern greece?;no;what was the name of james watt's mother?;agnus muirhead;1;1;0
111;Lyre;Where lyre is still played?;north-eastern parts of africa; lyre played;yes;is a guitar played with a plectrum like a lyre?;yes;in which place is lyre still played?;north-eastern parts of africa;what was the name of james watt's mother?;agnus muirhead;0;1;0
112;Michael Faraday;Who sponsored Faraday?;john 'mad jack' fuller; sponsored faraday;yes;who was the sponsor and mentor of faraday?;john 'mad jack' fuller;who was the sponsor and mentor of faraday?;"[""john 'mad jack' fuller""]";what was the name of james watt's mother?;agnus muirhead;1;0;0
113;Michael Faraday;In what place Faraday born?;newington butts; place faraday born;yes;when was michael faraday born?;september 22, 1791;was faraday born in england?;yes;what was the name of james watt's mother?;agnus muirhead;0;0;0
114;Michael Faraday;Who was Faraday?;chemist and physicist; faraday;yes;did faraday have strong maritime interests?;yes;what is the faraday effect?;the faraday effect is the phenomenon that the plane of polarisation of linearly polarised light can be rotated by the application of an external magnetic field aligned in the direction the light is moving.;what was the name of james watt's mother?;agnus muirhead;0;0;0
115;Michael Faraday;When is birth of Faraday?;september 22, 1791; birth faraday;yes;did faraday have strong maritime interests?;yes;what was michael faraday`s birthplace?;newington butts;what was the name of james watt's mother?;agnus muirhead;0;0;0
116;Nikola Tesla;Did electrical engineering was studied by Tesla?;yes; electrical engineering studied tesla;yes;did tesla study electrical engineering?;yes;did tesla study electrical engineering?;yes;what was the name of james watt's mother?;agnus muirhead;1;1;0
117;Nikola Tesla;When Tesla showed radio?;1893; tesla showed radio;yes;when did tesla demonstrate wireless communication (radio)?;1893;was tesla hired by edison?;yes;what was the name of james watt's mother?;agnus muirhead;1;0;0
118;Ottawa;How many population in Ottawa?;1,190,982; population ottawa;yes;what is ottawa's population?;1,190,982;"[""what is ottawa's population?""]";1,190,982;what was the name of james watt's mother?;agnus muirhead;1;1;0
119;Ottawa;Is it colder in Ottawa in winter than in Moskow?;yes; colder ottawa winter moskow;yes;does it snow in ottawa?;yes;is ottawa colder than moscow in january?;yes;what was the name of james watt's mother?;agnus muirhead;1;1;0
120;Ottawa;Is there a show in Ottawa?;yes; ottawa;yes;are there also discussions of having oc transpo light rail and sto transitway networks linking on the gatineau side of the ottawa river ?;yes.;does it snow in ottawa?;yes;what was the name of james watt's mother?;agnus muirhead;0;1;0
121;otter;Is water a habitat for otters?;yes; water habitat otters;yes;do otters live in water?;yes;do otters live in water?;yes;what was the name of james watt's mother?;agnus muirhead;1;1;0
122;otter;What is a wieight of sea otters?;30 kg (about 65 pounds); wieight sea otters;yes;how much do sea otters weigh?;30 kg (about 65 pounds);how much do sea otters weigh?;30 kg (about 65 pounds);what was the name of james watt's mother?;agnus muirhead;1;1;0
123;otter;What otters prefer to eat?;fish.; otters prefer eat;yes;what do river otters eat?;a variety of fish and shellfish, as well as small land mammals and birds;what do river otters eat?;a variety of fish and shellfish, as well as small land mammals and birds;what was the name of james watt's mother?;agnus muirhead;0;0;0
124;Otter;Do otters hunt fish?;yes; otters hunt fish;yes;do otters eat fish?;yes;do otters eat fish?;yes;what was the name of james watt's mother?;agnus muirhead;1;1;0
125;Santiago;Is Santiago a capital?;yes; santiago capital;yes;what is santiago?;"santiago is spanish for st. james. it is also the name of places in argentina, brazil, cape verde, chile, colombia, costa rica, cuba, the dominican republic, ecuador, guatemala, jamaica, mexico, nicaragua, panama, paraguay, peru, the philippines, portugal, spain, the united states, venezuela, and the amazon. it is also the name of a baseball catcher, a film director, a guitarist, an economist, a footballer, a dj, an actor, and james, son of zebedee. fictional people with this name include a character from gears of war, a character from chronicle of a death foretold, a character in old man and the sea, a character in babylon 5, a character in interview with the vampire, the main character of the alchemist, and a character on friday night lights. there has also been a battle of santiago de cuba, a couple of bands named santiago, an order of santiago, and ""santiago"" as a shortened form of the reconquista battle cry.";what is santiago?;"santiago is spanish for st. james. it is also the name of places in argentina, brazil, cape verde, chile, colombia, costa rica, cuba, the dominican republic, ecuador, guatemala, jamaica, mexico, nicaragua, panama, paraguay, peru, the philippines, portugal, spain, the united states, venezuela, and the amazon. it is also the name of a baseball catcher, a film director, a guitarist, an economist, a footballer, a dj, an actor, and james, son of zebedee. fictional people with this name include a character from gears of war, a character from chronicle of a death foretold, a character in old man and the sea, a character in babylon 5, a character in interview with the vampire, the main character of the alchemist, and a character on friday night lights. there has also been a battle of santiago de cuba, a couple of bands named santiago, an order of santiago, and ""santiago"" as a shortened form of the reconquista battle cry.";what was the name of james watt's mother?;agnus muirhead;0;0;0
126;Swan;How young swans called?;cygnets.; young swans called;yes;what is the name of young swans?;cygnets.;what is the name of young swans?;cygnets.;what was the name of james watt's mother?;agnus muirhead;1;1;0
127;Swan;Famous story about swan;the ugly duckling fable.; famous story swan;yes;what is the best known story about a swan?;the ugly duckling fable.;what is the best known story about a swan?;the ugly duckling fable.;what was the name of james watt's mother?;agnus muirhead;1;1;0
128;Tiger;Panthers are tygers?;no.; panthers tygers;yes;are panthers a type of tiger?;no.;are panthers a type of tiger?;no.;what was the name of james watt's mother?;agnus muirhead;1;1;0
